screen_width,window_height,workerId,totalTime_mins,comments,window_width,curId,unitFeel,curTime,clarity,screen_height
1536,742,A3L8LSM7V7KX3T,11,"No issues, all good.",1316,33C7UALJVMIYMDRKYDYSLC1LLKP18V,weak,06/08/2019@17:14:04,very-clear,864
1920,937,A322B3RU6LWYA,20,"For me, everything was explained clearly. The videos and audio, along with the text, were very clear and helpful for a variety of different learning styles. ",1853,35GMH2SV3F10R68CHII3PIAFPYAOEH,moderate,06/08/2019@20:06:55,very-clear,1080
1364,748,A37DBXBOF6C9B1,9,nice survey,1161,384PI804XTLGY8LBGS0XOYICSMY0SZ,no-relationship,06/08/2019@17:33:59,very-clear,768
1680,916,A2ETY1O927Z1IF,10,nothing everything was simple and easy to understand,1108,3ITXP059PX3N0EMX20A363X8RV2SJW,strong,06/08/2019@17:22:33,very-clear,1050
1366,745,AWZPYE91AF7KU,13,I thought everything was explained very well.,1282,3JZQSN0I3RU457RAOAP12RMDADKGFQ,moderate,06/08/2019@17:53:27,very-clear,768
